Name;Date;PlaceY;PlaceX;Axis;Allies;Text
First Battle of El Alamein;1942;-450;1000;Germany;Great Britain;Flavour Text. Some things happening.
Battle of Okinawa;1945;-570;1480;Japan;United States;Capture of the Island Okinawa by American forces
Battle of the Philippine Islands;1945;-625;1470;Japan;United States;American and Filipino campaign to defeat and expel Japanes forces in the Philippines.
Battle of Leyte Gulf;1944;-625;1470;Japan;United States;Largest naval battle in WW2. Attempt of the United States to isolate Japanese forces from the countries it had occupied in Southeast Asia.
Battle of Iwo Jima;1945;-550;1550;Japan;United States;Attempt to capture the Island Iwo Jima to use its airports.  
